{"$schema": "http://json-schema.org/draft-07/schema#", "additionalProperties": true, "properties": {"conditions": {"type": "object"}, "confidence": {"enum": ["high", "medium", "low"], "type": "string"}, "contraindications": {"type": "string"}, "domain": {"type": "string"}, "effect_size": {"type": "string"}, "evidence_type": {"type": "string"}, "id": {"pattern": "^KB\\d{2}$", "type": "string"}, "intervention": {"minLength": 10, "type": "string"}, "mechanism": {"minLength": 10, "type": "string"}, "metrics_improved": {"items": {"type": "string"}, "minItems": 1, "type": "array"}, "region_fit": {"items": {"type": "string"}, "type": "array"}, "source": {"type": "string"}, "source_url": {"type": "string"}, "tags": {"items": {"type": "string"}, "type": "array"}, "time_horizon": {"enum": ["short", "medium", "long"], "type": "string"}, "title": {"type": "string"}, "year": {"type": "integer"}}, "required": ["id", "title", "domain", "intervention", "mechanism", "metrics_improved", "effect_size", "time_horizon", "confidence", "source"], "title": "EvidenceCard", "type": "object"}
