[
 {
  "conditions": {
   "land_use": [
    "monoculture",
    "cropland"
   ],
   "rainfall_mm": "<600",
   "soc_pct": "<0.5"
  },
  "confidence": "high",
  "domain": "soil x biodiversity x climate",
  "effect_size": "SOC +15-25% in 2-3 yrs; pollinator visits +30-50%; microbial biomass +20-40%",
  "id": "KB01",
  "intervention": "Legume-based cover crops + intercropping (e.g., chickpea/lentil with wheat, no bare fallow)",
  "mechanism": "Biological N-fixation lowers C:N, adds labile root exudates feeding microbes; continuous floral resources bridge pollinator gaps in monoculture; living roots cut erosion and moisture loss.",
  "metrics_improved": [
   "soil_organic_carbon",
   "microbial_diversity",
   "pollinator_richness",
   "soil_moisture"
  ],
  "region_fit": [
   "semi-arid",
   "dry-subhumid"
  ],
  "source": "FAO Soils & Agroecology (2017, 2022); Poeplau & Don meta-analysis, Global Change Biology (2015)",
  "time_horizon": "medium",
  "title": "Legume cover/intercrop restores SOC and pollinators in cereal monocultures"
 },
 {
  "conditions": {
   "rainfall_mm": "<600",
   "soc_pct": "<1.0"
  },
  "confidence": "high",
  "domain": "soil x climate x biodiversity",
  "effect_size": "SOC +0.2-0.5 tC/ha/yr; soil water +15-30%; bird/insect richness +40-60% vs monoculture",
  "id": "KB02",
  "intervention": "Parkland agroforestry: scattered native N-fixers (Prosopis cineraria / Faidherbia albida) at 10-20 trees/ha + crop alleys",
  "mechanism": "Deep roots hydraulic-lift water; leaf litter builds SOC; canopy creates microclimate (-2-4C heat stress) and stepping-stone habitat breaking fragmentation.",
  "metrics_improved": [
   "soil_organic_carbon",
   "habitat_connectivity",
   "species_richness",
   "soil_moisture"
  ],
  "region_fit": [
   "semi-arid",
   "arid"
  ],
  "source": "FAO Agroforestry (2019); IPCC AR6 WGIII Ch.7 AFOLU; Bargues-Tobella et al., 2020",
  "time_horizon": "long",
  "title": "Semi-arid parkland agroforestry for carbon, water, habitat"
 },
 {
  "conditions": {
   "land_use": [
    "cropland"
   ]
  },
  "confidence": "high",
  "domain": "soil x biodiversity",
  "effect_size": "SOC +10-20% in 3-5 yrs; earthworms x1.5-2; runoff -40%",
  "id": "KB03",
  "intervention": "No-till + residue retention (30%+ cover, Happy Seeder style)",
  "mechanism": "Undisturbed fungal hyphae + aggregate protection stabilizes carbon; residue mulch buffers pH and moisture, shelter for ground beetles/spiders.",
  "metrics_improved": [
   "soil_organic_carbon",
   "soil_moisture",
   "invertebrate_diversity"
  ],
  "region_fit": [
   "semi-arid",
   "subhumid",
   "temperate"
  ],
  "source": "IPCC AR6 WGIII; FAO Conservation Agriculture; Pittelkow et al. meta-analysis",
  "time_horizon": "medium",
  "title": "Conservation tillage protects soil biota"
 },
 {
  "conditions": {
   "rainfall_mm": "<600"
  },
  "confidence": "high",
  "domain": "climate x soil x biodiversity",
  "effect_size": "Soil moisture +25-40%; crop survival in drought +30%; amphibian/insect refugia +50%",
  "id": "KB04",
  "intervention": "Rainwater harvesting: contour bunds + farm ponds + mulch pits (5-10% area)",
  "mechanism": "Concentrates scarce rainfall into infiltration zones; rewets soil profile extending growing season; ponds double as dry-season wildlife water.",
  "metrics_improved": [
   "soil_moisture",
   "species_survival",
   "groundwater_recharge"
  ],
  "region_fit": [
   "semi-arid",
   "arid"
  ],
  "source": "UNCCD Drought Toolbox; FAO Water Harvesting; IPCC AR6 Adaptation",
  "time_horizon": "short",
  "title": "In-situ water harvesting buffers low rainfall"
 },
 {
  "conditions": {
   "land_use": [
    "monoculture",
    "fragmented"
   ]
  },
  "confidence": "high",
  "domain": "land use x biodiversity",
  "effect_size": "Pollination +20-40%; pest control -30% pesticide; bird richness +25%",
  "id": "KB05",
  "intervention": "5-10% beetle banks + native hedgerows + wildflower strips on field margins",
  "mechanism": "Linear woody/floral corridors reconnect fragments (island biogeography); overwintering habitat for predators/parasitoids; unfamiliar to pests but familiar to pollinators.",
  "metrics_improved": [
   "habitat_diversity",
   "pollinator_richness",
   "pest_regulation"
  ],
  "region_fit": [
   "all"
  ],
  "source": "IPBES 2019; Dainese et al., Science Advances (2019); UK CEH long-term trials",
  "time_horizon": "short",
  "title": "Field-margin corridors defeat fragmentation cheaply"
 },
 {
  "conditions": {
   "soil_ph": "<5.5 or >8.2"
  },
  "confidence": "medium",
  "domain": "soil x biodiversity",
  "effect_size": "pH toward 6.0-7.5 in 1-2 seasons; microbial diversity +25%; nutrient availability +20%",
  "id": "KB06",
  "intervention": "pH-targeted amendment: lime for acidic / gypsum + organic matter for sodic-alkaline",
  "mechanism": "pH gates bacterial:fungal ratio and P/micronutrient solubility; correcting unlocks existing nutrients before adding fertilizer.",
  "metrics_improved": [
   "soil_ph",
   "microbial_diversity",
   "nutrient_cycling"
  ],
  "region_fit": [
   "all"
  ],
  "source": "FAO Soil pH Management; Weil & Brady Nature of Soils",
  "time_horizon": "short",
  "title": "Correct pH first, fertilize second"
 },
 {
  "conditions": {
   "land_use": [
    "degraded",
    "overgrazed"
   ]
  },
  "confidence": "medium",
  "domain": "land use x climate",
  "effect_size": "Vegetation cover +40-70% in 2 yrs; SOC +0.3 tC/ha/yr",
  "id": "KB07",
  "intervention": "Rotational grazing + planned rest (holistic, 60-90 day recovery)",
  "mechanism": "Rest lets root reserves rebuild; trampling breaks capped soil improving infiltration; dung patch mosaic boosts plant heterogeneity.",
  "metrics_improved": [
   "vegetation_cover",
   "soil_organic_carbon",
   "habitat_diversity"
  ],
  "region_fit": [
   "semi-arid",
   "grassland"
  ],
  "source": "FAO Grazing Management; Teague et al., 2016",
  "time_horizon": "medium",
  "title": "Managed grazing reverses degradation"
 },
 {
  "conditions": {
   "human_impact": [
    "pesticide",
    "pollution"
   ]
  },
  "confidence": "high",
  "domain": "human impact x biodiversity",
  "effect_size": "Pollinator survival +40%; aquatic invertebrates +35%",
  "id": "KB08",
  "intervention": "IPM: pheromone traps + threshold spraying + 10m no-spray buffer near water",
  "mechanism": "Cuts non-target mortality; buffers stop drift into wetlands; natural enemies rebound within one season once broad-spectrum use stops.",
  "metrics_improved": [
   "pollinator_richness",
   "water_quality",
   "pest_regulation"
  ],
  "region_fit": [
   "all"
  ],
  "source": "IPBES Pollinators (2016); FAO IPM; Hallmann et al. flying insects 75% decline study",
  "time_horizon": "short",
  "title": "IPM + buffers stop silent pollinator collapse"
 },
 {
  "conditions": {
   "human_impact": [
    "deforestation"
   ]
  },
  "confidence": "high",
  "domain": "land use x climate x biodiversity",
  "effect_size": "Edge species +30%; carbon +50-100 tC/ha over 10 yrs",
  "id": "KB09",
  "intervention": "Riparian + degraded patch assisted natural regeneration (protect + mulch + exclude fire/grazing)",
  "mechanism": "ANR leverages soil seed bank and root suckers â€” 3-5x cheaper than planting; riparian shade cools water +2-3C saving fish/amphibians.",
  "metrics_improved": [
   "habitat_connectivity",
   "species_richness",
   "soil_organic_carbon"
  ],
  "region_fit": [
   "tropical",
   "subhumid",
   "semi-arid"
  ],
  "source": "FAO Forest Restoration; IPCC AR6; Chazdon & Guariguata, 2016",
  "time_horizon": "long",
  "title": "Assisted natural regeneration beats planting on cost"
 },
 {
  "conditions": {
   "soil_moisture": "low",
   "temperature_c": ">32"
  },
  "confidence": "medium",
  "domain": "climate x soil",
  "effect_size": "Evaporation -30-50%; soil temp -3-5C; SOC loss slowed 20%",
  "id": "KB10",
  "intervention": "Heavy organic mulch (5-10 t/ha straw/leaves) + shade trees on west edge",
  "mechanism": "Mulch decouples soil from hot air; cooler soil respires less CO2 and keeps microbes alive through heatwaves.",
  "metrics_improved": [
   "soil_moisture",
   "soil_temperature",
   "microbial_diversity"
  ],
  "region_fit": [
   "semi-arid",
   "arid"
  ],
  "source": "FAO Soil Mulching; IPCC AR6 Adaptation; Lal 2020",
  "time_horizon": "short",
  "title": "Mulch + shade as heat insurance"
 },
 {
  "conditions": {
   "land_use": [
    "monoculture"
   ]
  },
  "confidence": "medium",
  "domain": "soil x biodiversity",
  "effect_size": "Nematode diversity +30%; yield stability +15% in drought",
  "id": "KB11",
  "intervention": "3-year rotation: cereal-legume-millet/oilseed + mycorrhizal inoculant on degraded patches",
  "mechanism": "Different root exudates select different microbes breaking pathogen build-up; mycorrhizae extend phosphorus scavenging 10x root radius.",
  "metrics_improved": [
   "microbial_diversity",
   "nutrient_cycling",
   "yield_resilience"
  ],
  "region_fit": [
   "semi-arid",
   "subhumid"
  ],
  "source": "FAO Crop Diversification; Bowles et al., Nature Food 2020",
  "time_horizon": "medium",
  "title": "Rotation breaks monoculture disease-SOC trap"
 },
 {
  "conditions": {
   "human_impact": [
    "nutrient_runoff"
   ]
  },
  "confidence": "medium",
  "domain": "human impact x biodiversity",
  "effect_size": "N runoff -40-60%; wetland birds +25%",
  "id": "KB12",
  "intervention": "Constructed wetland / vegetated filter strip (2-5% lowland area)",
  "mechanism": "Sedges/reeds denitrify and trap sediment; doubles as breeding habitat â€” pollution control becomes habitat creation.",
  "metrics_improved": [
   "water_quality",
   "habitat_diversity",
   "species_richness"
  ],
  "region_fit": [
   "subhumid",
   "humid",
   "irrigated"
  ],
  "source": "Ramsar; FAO Nutrient Management; Verhoeven et al.",
  "time_horizon": "medium",
  "title": "Filter wetlands turn runoff into habitat"
 },
 {
  "conditions": {
   "rainfall_mm": ">1000",